id,label,effectiveTime,active,moduleId,definitionStatusId
299075003,Active range of finger extension (observable entity),20020131,1,900000000000207008,900000000000074008
315503000,Born in Poland (finding),20020131,1,900000000000207008,900000000000074008
315504006,Born in Portugal (finding),20020131,1,900000000000207008,900000000000074008
315505007,Born in Puerto Rico (finding),20020131,1,900000000000207008,900000000000074008
315547006,Born in Turkey (finding),20020131,1,900000000000207008,900000000000074008
298946001,Wrist joint - range of movement (observable entity),20020131,1,900000000000207008,900000000000074008
298947005,Range of wrist flexion (observable entity),20020131,1,900000000000207008,900000000000074008
298948000,Active range of wrist flexion (observable entity),20020131,1,900000000000207008,900000000000074008
315546002,Born in Tunisia (finding),20020131,1,900000000000207008,900000000000074008
315545003,Born in Trinidad and Tobago (finding),20020131,1,900000000000207008,900000000000074008
315544004,Born in Tonga (finding),20020131,1,900000000000207008,900000000000074008
315543005,Born in Togo (finding),20020131,1,900000000000207008,900000000000074008
298953005,Passive range of wrist flexion (observable entity),20020131,1,900000000000207008,900000000000074008
315542000,Born in The Netherlands (finding),20020131,1,900000000000207008,900000000000074008
315540008,Born in Thailand (finding),20020131,1,900000000000207008,900000000000074008
315539006,Born in Tanzania (finding),20020131,1,900000000000207008,900000000000074008
315538003,Born in Tajikistan (finding),20020131,1,900000000000207008,900000000000074008
298958001,Range of wrist extension (observable entity),20020131,1,900000000000207008,900000000000074008
298959009,Active range of wrist extension (observable entity),20020131,1,900000000000207008,900000000000074008
315537008,Born in Taiwan (finding),20020131,1,900000000000207008,900000000000074008
315536004,Born in Syria (finding),20020131,1,900000000000207008,900000000000074008
315548001,Born in Turkmenistan (finding),20020131,1,900000000000207008,900000000000074008
315535000,Born in Switzerland (finding),20020131,1,900000000000207008,900000000000074008
315549009,Born in Tuvalu (finding),20020131,1,900000000000207008,900000000000074008
298923003,Elbow joint stability (observable entity),20020131,1,900000000000207008,900000000000074008
315561001,Born in Western Samoa (finding),20020131,1,900000000000207008,900000000000074008
315560000,Born in Wales (finding),20020131,1,900000000000207008,900000000000074008
315559005,Born in Vietnam (finding),20020131,1,900000000000207008,900000000000074008
315558002,Born in Venezuela (finding),20020131,1,900000000000207008,900000000000074008
315557007,Born in Vatican City (finding),20020131,1,900000000000207008,900000000000074008
315556003,Born in Vanuatu (finding),20020131,1,900000000000207008,900000000000074008
315555004,Born in Uzbekistan (finding),20020131,1,900000000000207008,900000000000074008
298933006,Elbow joint color (observable entity),20020131,1,900000000000207008,900000000000074008
315554000,Born in Uruguay (finding),20020131,1,900000000000207008,900000000000074008
315553006,Born in United Arab Emirates (finding),20020131,1,900000000000207008,900000000000074008
315552001,Born in Ukraine (finding),20020131,1,900000000000207008,900000000000074008
315551008,Born in Uganda (finding),20020131,1,900000000000207008,900000000000074008
315550009,Born in United States of America (finding),20020131,1,900000000000207008,900000000000074008
315455002,Born in Kazakhstan (finding),20020131,1,900000000000207008,900000000000074008
315534001,Born in Sweden (finding),20020131,1,900000000000207008,900000000000074008
315533007,Born in Swaziland (finding),20020131,1,900000000000207008,900000000000074008
315517009,Born in Seychelles (finding),20020131,1,900000000000207008,900000000000074008
315516000,Born in Senegal (finding),20020131,1,900000000000207008,900000000000074008
315515001,Born in Scotland (finding),20020131,1,900000000000207008,900000000000074008
315514002,Born in Saudi Arabia (finding),20020131,1,900000000000207008,900000000000074008
298991005,Range of wrist supination (observable entity),20020131,1,900000000000207008,900000000000074008
298992003,Active range of wrist supination (observable entity),20020131,1,900000000000207008,900000000000074008
315513008,Born in Sao Tome and Principe (finding),20020131,1,900000000000207008,900000000000074008
315512003,Born in San Marino (finding),20020131,1,900000000000207008,900000000000074008
315511005,Born in Rwanda (finding),20020131,1,900000000000207008,900000000000074008
315510006,Born in Russia (finding),20020131,1,900000000000207008,900000000000074008
298997009,Passive range of wrist supination (observable entity),20020131,1,900000000000207008,900000000000074008
315509001,Born in Romania (finding),20020131,1,900000000000207008,900000000000074008
315508009,Born in Republic of Korea (finding),20020131,1,900000000000207008,900000000000074008
315507004,Born in Republic of Ireland (finding),20020131,1,900000000000207008,900000000000074008
315506008,Born in Qatar (finding),20020131,1,900000000000207008,900000000000074008
299002001,Range of wrist pronation (observable entity),20020131,1,900000000000207008,900000000000074008
299003006,Active range of wrist pronation (observable entity),20020131,1,900000000000207008,900000000000074008
298986009,Passive range of wrist adduction (observable entity),20020131,1,900000000000207008,900000000000074008
298964008,Passive range of wrist extension (observable entity),20020131,1,900000000000207008,900000000000074008
315518004,Born in Sierra Leone (finding),20020131,1,900000000000207008,900000000000074008
315520001,Born in Slovakia (finding),20020131,1,900000000000207008,900000000000074008
315532002,Born in Suriname (finding),20020131,1,900000000000207008,900000000000074008
315531009,Born in Sudan (finding),20020131,1,900000000000207008,900000000000074008
315530005,Born in St. Vincent (finding),20020131,1,900000000000207008,900000000000074008
298969003,Range of wrist abduction (observable entity),20020131,1,900000000000207008,900000000000074008
298970002,Active range of wrist abduction (observable entity),20020131,1,900000000000207008,900000000000074008
315529000,Born in St. Lucia (finding),20020131,1,900000000000207008,900000000000074008
315528008,Born in St. Kitts and Nevis (finding),20020131,1,900000000000207008,900000000000074008
315527003,Born in Sri Lanka (finding),20020131,1,900000000000207008,900000000000074008
315526007,Born in Spain (finding),20020131,1,900000000000207008,900000000000074008
298975007,Passive range of wrist abduction (observable entity),20020131,1,900000000000207008,900000000000074008
315525006,Born in South Korea (finding),20020131,1,900000000000207008,900000000000074008
315524005,Born in South Africa (finding),20020131,1,900000000000207008,900000000000074008
315523004,Born in Somalia (finding),20020131,1,900000000000207008,900000000000074008
315522009,Born in Solomon Islands (finding),20020131,1,900000000000207008,900000000000074008
298980003,Range of wrist adduction (observable entity),20020131,1,900000000000207008,900000000000074008
298981004,Active range of wrist adduction (observable entity),20020131,1,900000000000207008,900000000000074008
315521002,Born in Slovenia (finding),20020131,1,900000000000207008,900000000000074008
315519007,Born in Singapore (finding),20020131,1,900000000000207008,900000000000074008
299096005,Range of finger adduction (observable entity),20020131,1,900000000000207008,900000000000074008
299097001,Active range of finger adduction (observable entity),20020131,1,900000000000207008,900000000000074008
315454003,Born in Jordan (finding),20020131,1,900000000000207008,900000000000074008
315380003,Born in Barbados (finding),20020131,1,900000000000207008,900000000000074008
315379001,Born in Bangladesh (finding),20020131,1,900000000000207008,900000000000074008
315378009,Born in Bahrain (finding),20020131,1,900000000000207008,900000000000074008
315377004,Born in Bahamas (finding),20020131,1,900000000000207008,900000000000074008
299220001,Leg size (observable entity),20020131,1,900000000000207008,900000000000074008
315381004,Born in Belgium (finding),20020131,1,900000000000207008,900000000000074008
315382006,Born in Belize (finding),20020131,1,900000000000207008,900000000000074008
299203000,Thumb joint color (observable entity),20020131,1,900000000000207008,900000000000074008
315396000,Born in Cambodia (finding),20020131,1,900000000000207008,900000000000074008
315395001,Born in Burundi (finding),20020131,1,900000000000207008,900000000000074008
315394002,Born in Burma (finding),20020131,1,900000000000207008,900000000000074008
299189005,Passive range of thumb opposition (observable entity),20020131,1,900000000000207008,900000000000074008
315393008,Born in Burkina Faso (finding),20020131,1,900000000000207008,900000000000074008
315392003,Born in Bulgaria (finding),20020131,1,900000000000207008,900000000000074008
315391005,Born in Brunei (finding),20020131,1,900000000000207008,900000000000074008
315390006,Born in British Guyana (finding),20020131,1,900000000000207008,900000000000074008
299194005,Thumb joint stability (observable entity),20020131,1,900000000000207008,900000000000074008
315389002,Born in Brazil (finding),20020131,1,900000000000207008,900000000000074008
315388005,Born in Botswana (finding),20020131,1,900000000000207008,900000000000074008
315387000,Born in Bosnia - Herzegovnia (finding),20020131,1,900000000000207008,900000000000074008
315386009,Born in Bolivia (finding),20020131,1,900000000000207008,900000000000074008
315385008,Born in Bhutan (finding),20020131,1,900000000000207008,900000000000074008
315384007,Born in Benin (finding),20020131,1,900000000000207008,900000000000074008
315383001,Born in Belorussia (finding),20020131,1,900000000000207008,900000000000074008
315397009,Born in Cameroon (finding),20020131,1,900000000000207008,900000000000074008
315376008,Born in Azerbaijan (finding),20020131,1,900000000000207008,900000000000074008
299256003,Passive range of hip extension (observable entity),20020131,1,900000000000207008,900000000000074008
315360004,Country of birth - Atlantic (finding),20020131,1,900000000000207008,900000000000074008
315359009,Country of birth - Australasian (finding),20020131,1,900000000000207008,900000000000074008
315358001,Country of birth - African (finding),20020131,1,900000000000207008,900000000000074008
315357006,Country of birth - American continent (finding),20020131,1,900000000000207008,900000000000074008
299261001,Range of hip abduction (observable entity),20020131,1,900000000000207008,900000000000074008
299262008,Active range of hip abduction (observable entity),20020131,1,900000000000207008,900000000000074008
315356002,Country of birth - Asian (finding),20020131,1,900000000000207008,900000000000074008
315355003,Country of birth - European (finding),20020131,1,900000000000207008,900000000000074008
315354004,Country of birth (observable entity),20020131,1,900000000000207008,900000000000074008
299267002,Passive range of hip abduction (observable entity),20020131,1,900000000000207008,900000000000074008
299272006,Range of hip adduction (observable entity),20020131,1,900000000000207008,900000000000074008
299273001,Active range of hip adduction (observable entity),20020131,1,900000000000207008,900000000000074008
315361000,Country of birth - Pacific (finding),20020131,1,900000000000207008,900000000000074008
315365009,Born in Afghanistan (finding),20020131,1,900000000000207008,900000000000074008
315375007,Born in Austria (finding),20020131,1,900000000000207008,900000000000074008
315374006,Born in Australia (finding),20020131,1,900000000000207008,900000000000074008
299238003,Hip joint - range of movement (observable entity),20020131,1,900000000000207008,900000000000074008
299239006,Range of hip flexion (observable entity),20020131,1,900000000000207008,900000000000074008
299240008,Active range of hip flexion (observable entity),20020131,1,900000000000207008,900000000000074008
315373000,Born in Armenia (finding),20020131,1,900000000000207008,900000000000074008
315372005,Born in Argentina (finding),20020131,1,900000000000207008,900000000000074008
315370002,Born in Antigua and Barbuda (finding),20020131,1,900000000000207008,900000000000074008
299245003,Passive range of hip flexion (observable entity),20020131,1,900000000000207008,900000000000074008
315369003,Born in Angola (finding),20020131,1,900000000000207008,900000000000074008
315368006,Born in Andorra (finding),20020131,1,900000000000207008,900000000000074008
315367001,Born in Algeria (finding),20020131,1,900000000000207008,900000000000074008
315366005,Born in Albania (finding),20020131,1,900000000000207008,900000000000074008
299250009,Range of hip extension (observable entity),20020131,1,900000000000207008,900000000000074008
299251008,Active range of hip extension (observable entity),20020131,1,900000000000207008,900000000000074008
315562008,Born in Yugoslavia (finding),20020131,1,900000000000207008,900000000000074008
299184000,Active range of thumb opposition (observable entity),20020131,1,900000000000207008,900000000000074008
315398004,Born in Canada (finding),20020131,1,900000000000207008,900000000000074008
315437006,Born in Guinea Republic (finding),20020131,1,900000000000207008,900000000000074008
315436002,Born in Guinea Bissau (finding),20020131,1,900000000000207008,900000000000074008
315435003,Born in Guatemala (finding),20020131,1,900000000000207008,900000000000074008
315434004,Born in Grenada (finding),20020131,1,900000000000207008,900000000000074008
315433005,Born in Greece (finding),20020131,1,900000000000207008,900000000000074008
299129008,Form of thumb (observable entity),20020131,1,900000000000207008,900000000000074008
315432000,Born in Ghana (finding),20020131,1,900000000000207008,900000000000074008
315431007,Born in Germany (finding),20020131,1,900000000000207008,900000000000074008
299138005,Thumb joint - range of movement (observable entity),20020131,1,900000000000207008,900000000000074008
299139002,Range of thumb flexion (observable entity),20020131,1,900000000000207008,900000000000074008
315438001,Born in Guyana (finding),20020131,1,900000000000207008,900000000000074008
299140000,Active range of thumb flexion (observable entity),20020131,1,900000000000207008,900000000000074008
315439009,Born in Haiti (finding),20020131,1,900000000000207008,900000000000074008
299116008,Finger joint color (observable entity),20020131,1,900000000000207008,900000000000074008
315453009,Born in Japan (finding),20020131,1,900000000000207008,900000000000074008
315452004,Born in Jamaica (finding),20020131,1,900000000000207008,900000000000074008
315451006,Born in Ivory Coast (finding),20020131,1,900000000000207008,900000000000074008
299102003,Passive range of finger adduction (observable entity),20020131,1,900000000000207008,900000000000074008
315450007,Born in Italy (finding),20020131,1,900000000000207008,900000000000074008
315449007,Born in Israel (finding),20020131,1,900000000000207008,900000000000074008
315448004,Born in Ireland (finding),20020131,1,900000000000207008,900000000000074008
315447009,Born in Iraq (finding),20020131,1,900000000000207008,900000000000074008
299107009,Finger joint stability (observable entity),20020131,1,900000000000207008,900000000000074008
315446000,Born in Iran (finding),20020131,1,900000000000207008,900000000000074008
315445001,Born in Indonesia (finding),20020131,1,900000000000207008,900000000000074008
315444002,Born in India (finding),20020131,1,900000000000207008,900000000000074008
315443008,Born in Iceland (finding),20020131,1,900000000000207008,900000000000074008
315442003,Born in Hungary (finding),20020131,1,900000000000207008,900000000000074008
315441005,Born in Hong Kong (finding),20020131,1,900000000000207008,900000000000074008
315440006,Born in Honduras (finding),20020131,1,900000000000207008,900000000000074008
299183006,Range of thumb opposition (observable entity),20020131,1,900000000000207008,900000000000074008
315430008,Born in Georgia (finding),20020131,1,900000000000207008,900000000000074008
315428006,Born in Gabon (finding),20020131,1,900000000000207008,900000000000074008
315412001,Born in Czech Republic (finding),20020131,1,900000000000207008,900000000000074008
315411008,Born in Cyprus (finding),20020131,1,900000000000207008,900000000000074008
299167006,Passive range of thumb abduction (observable entity),20020131,1,900000000000207008,900000000000074008
315410009,Born in Cuba (finding),20020131,1,900000000000207008,900000000000074008
315409004,Born in Croatia (finding),20020131,1,900000000000207008,900000000000074008
315408007,Born in Costa Rica (finding),20020131,1,900000000000207008,900000000000074008
315407002,Born in Congo (finding),20020131,1,900000000000207008,900000000000074008
299172002,Range of thumb adduction (observable entity),20020131,1,900000000000207008,900000000000074008
299173007,Active range of thumb adduction (observable entity),20020131,1,900000000000207008,900000000000074008
315406006,Born in Comoros Islands (finding),20020131,1,900000000000207008,900000000000074008
315405005,Born in Colombia (finding),20020131,1,900000000000207008,900000000000074008
315404009,Born in China (finding),20020131,1,900000000000207008,900000000000074008
315403003,Born in Chile (finding),20020131,1,900000000000207008,900000000000074008
299178003,Passive range of thumb adduction (observable entity),20020131,1,900000000000207008,900000000000074008
315402008,Born in Chechnya (finding),20020131,1,900000000000207008,900000000000074008
315401001,Born in Chad (finding),20020131,1,900000000000207008,900000000000074008
315400000,Born in Central African Republic (finding),20020131,1,900000000000207008,900000000000074008
315413006,Born in Democratic People's Republic of Korea (finding),20020131,1,900000000000207008,900000000000074008
315429003,Born in Gambia (finding),20020131,1,900000000000207008,900000000000074008
315414000,Born in Denmark (finding),20020131,1,900000000000207008,900000000000074008
299161007,Range of thumb abduction (observable entity),20020131,1,900000000000207008,900000000000074008
315427001,Born in France (finding),20020131,1,900000000000207008,900000000000074008
299145005,Passive range of thumb flexion (observable entity),20020131,1,900000000000207008,900000000000074008
315426005,Born in Finland (finding),20020131,1,900000000000207008,900000000000074008
315425009,Born in Fiji (finding),20020131,1,900000000000207008,900000000000074008
315424008,Born in Ethiopia (finding),20020131,1,900000000000207008,900000000000074008
315423002,Born in Estonia (finding),20020131,1,900000000000207008,900000000000074008
299150004,Range of thumb extension (observable entity),20020131,1,900000000000207008,900000000000074008
299151000,Active range of thumb extension (observable entity),20020131,1,900000000000207008,900000000000074008
315422007,Born in Equatorial Guinea (finding),20020131,1,900000000000207008,900000000000074008
315421000,Born in England (finding),20020131,1,900000000000207008,900000000000074008
315420004,Born in El Salvador (finding),20020131,1,900000000000207008,900000000000074008
315419005,Born in Egypt (finding),20020131,1,900000000000207008,900000000000074008
299156005,Passive range of thumb extension (observable entity),20020131,1,900000000000207008,900000000000074008
315418002,Born in Ecuador (finding),20020131,1,900000000000207008,900000000000074008
315417007,Born in East Timor (finding),20020131,1,900000000000207008,900000000000074008
315416003,Born in Dominican Republic (finding),20020131,1,900000000000207008,900000000000074008
315415004,Born in Djibouti (finding),20020131,1,900000000000207008,900000000000074008
299162000,Active range of thumb abduction (observable entity),20020131,1,900000000000207008,900000000000074008
315563003,Born in Zaire (finding),20020131,1,900000000000207008,900000000000074008
315565005,Born in Zimbabwe (finding),20020131,1,900000000000207008,900000000000074008
298651009,Passive range of lumbar spine right rotation (observable entity),20020131,1,900000000000207008,900000000000074008
298656004,Range of lumbar spine left rotation (observable entity),20020131,1,900000000000207008,900000000000074008
298657008,Active range of lumbar spine left rotation (observable entity),20020131,1,900000000000207008,900000000000074008
298662009,Passive range of lumbar spine left rotation (observable entity),20020131,1,900000000000207008,900000000000074008
298718008,Chest circumference - inspiration (observable entity),20020131,1,900000000000207008,900000000000074008
298719000,Chest circumference - expiration (observable entity),20020131,1,900000000000207008,900000000000074008
298691007,Lasgue test response (observable entity),20020131,1,900000000000207008,900000000000074008
298646003,Active range of lumbar spine right rotation (observable entity),20020131,1,900000000000207008,900000000000074008
298599001,Lumbar spine - range of movement (observable entity),20020131,1,900000000000207008,900000000000074008
298600003,Range of flexion of lumbar spine (observable entity),20020131,1,900000000000207008,900000000000074008
298601004,Active range of lumbar spine flexion (observable entity),20020131,1,900000000000207008,900000000000074008
298563006,Active range of thoracic spine left rotation (observable entity),20020131,1,900000000000207008,900000000000074008
298568002,Passive range of thoracic spine left rotation (observable entity),20020131,1,900000000000207008,900000000000074008
298606009,Passive range of lumbar spine flexion (observable entity),20020131,1,900000000000207008,900000000000074008
298629001,Passive range of lumbar spine right lateral flexion (observable entity),20020131,1,900000000000207008,900000000000074008
298634002,Range of lumbar spine left lateral flexion (observable entity),20020131,1,900000000000207008,900000000000074008
298635001,Active range of lumbar spine left lateral flexion (observable entity),20020131,1,900000000000207008,900000000000074008
298640009,Passive range of lumbar spine left lateral flexion (observable entity),20020131,1,900000000000207008,900000000000074008
298645004,Range of lumbar spine right rotation (observable entity),20020131,1,900000000000207008,900000000000074008
298611006,Range of lumbar spine extension (observable entity),20020131,1,900000000000207008,900000000000074008
298612004,Active range of lumbar spine extension (observable entity),20020131,1,900000000000207008,900000000000074008
298617005,Passive range of lumbar spine extension (observable entity),20020131,1,900000000000207008,900000000000074008
298622005,Range of lumbar spine right lateral flexion (observable entity),20020131,1,900000000000207008,900000000000074008
298624006,Active range of lumbar spine right lateral flexion (observable entity),20020131,1,900000000000207008,900000000000074008
298862006,Shoulder joint color (observable entity),20020131,1,900000000000207008,900000000000074008
298837006,Passive range of shoulder external rotation (observable entity),20020131,1,900000000000207008,900000000000074008
298842003,Range of shoulder circumduction (observable entity),20020131,1,900000000000207008,900000000000074008
298843008,Active range of shoulder circumduction (observable entity),20020131,1,900000000000207008,900000000000074008
298848004,Passive range of shoulder circumduction (observable entity),20020131,1,900000000000207008,900000000000074008
298853009,Shoulder joint stability (observable entity),20020131,1,900000000000207008,900000000000074008
298878008,Elbow joint - range of movement (observable entity),20020131,1,900000000000207008,900000000000074008
298880002,Active range of elbow flexion (observable entity),20020131,1,900000000000207008,900000000000074008
298902009,Active range of elbow supination (observable entity),20020131,1,900000000000207008,900000000000074008
315577000,Main spoken language Kutchi (finding),20020131,1,900000000000207008,900000000000074008
315576009,Main spoken language Iba (finding),20020131,1,900000000000207008,900000000000074008
315575008,Main spoken language Hindi (finding),20020131,1,900000000000207008,900000000000074008
315574007,Main spoken language Hausa (finding),20020131,1,900000000000207008,900000000000074008
298907003,Passive range of elbow supination (observable entity),20020131,1,900000000000207008,900000000000074008
315572006,Main spoken language Gujerati (finding),20020131,1,900000000000207008,900000000000074008
315571004,Main spoken language French (finding),20020131,1,900000000000207008,900000000000074008
315570003,Main spoken language English (finding),20020131,1,900000000000207008,900000000000074008
298912002,Range of elbow pronation (observable entity),20020131,1,900000000000207008,900000000000074008
298913007,Active range of elbow pronation (observable entity),20020131,1,900000000000207008,900000000000074008
315569004,Main spoken language Czech (finding),20020131,1,900000000000207008,900000000000074008
315568007,Main spoken language Cantonese (finding),20020131,1,900000000000207008,900000000000074008
315567002,Main spoken language Bengali (finding),20020131,1,900000000000207008,900000000000074008
315566006,Main spoken language Arabic (finding),20020131,1,900000000000207008,900000000000074008
298918003,Passive range of elbow pronation (observable entity),20020131,1,900000000000207008,900000000000074008
298901002,Range of elbow supination (observable entity),20020131,1,900000000000207008,900000000000074008
298879000,Range of elbow flexion (observable entity),20020131,1,900000000000207008,900000000000074008
315578005,Main spoken language Mandarin (finding),20020131,1,900000000000207008,900000000000074008
315580004,Main spoken language Portuguese (finding),20020131,1,900000000000207008,900000000000074008
315590007,Born in Yemen (finding),20020131,1,900000000000207008,900000000000074008
