id,label,effectiveTime,active,moduleId,definitionStatusId
224961000,Ability to sleep (observable entity),20020131,1,900000000000207008,900000000000074008
224992003,Mental defense mechanisms (observable entity),20020131,1,900000000000207008,900000000000074008
224433004,Availability of workplace drinking water (observable entity),20020131,1,900000000000207008,900000000000074008
224437003,Availability of workplace welfare facility (observable entity),20020131,1,900000000000207008,900000000000074008
224441004,Availability of workplace rest area facilities (observable entity),20020131,1,900000000000207008,900000000000074008
224429006,Availability of workplace vending machine facilities (observable entity),20020131,1,900000000000207008,900000000000074008
224412008,Availability of facilities in workplace (observable entity),20020131,1,900000000000207008,900000000000074008
224413003,Availability of workplace toilet facilities (observable entity),20020131,1,900000000000207008,900000000000074008
224417002,Availability of workplace handwashing facilities (observable entity),20020131,1,900000000000207008,900000000000074008
224421009,Availability of workplace shower facilities (observable entity),20020131,1,900000000000207008,900000000000074008
224425000,Availability of workplace canteen facilities (observable entity),20020131,1,900000000000207008,900000000000074008
224475003,Detail of care and support circumstances and networks (observable entity),20020131,1,900000000000207008,900000000000074008
224476002,Availability of help from lay caregiver (observable entity),20020131,1,900000000000207008,900000000000074008
224487005,Details of informal caregiver (observable entity),20020131,1,900000000000207008,900000000000074008
224488000,Willingness of caregiver to provide care (observable entity),20020131,1,900000000000207008,900000000000074008
224463008,Details relating to changes in job (observable entity),20020131,1,900000000000207008,900000000000074008
224469007,Prospects of promotion (observable entity),20020131,1,900000000000207008,900000000000074008
224409005,Time spent working away from home (observable entity),20020131,1,900000000000207008,900000000000074008
224348009,Enduring power of attorney (observable entity),20020131,1,900000000000207008,900000000000074008
224350001,Eligibility for criminal injuries compensation (observable entity),20020131,1,900000000000207008,900000000000074008
224359000,Duration of military service (observable entity),20020131,1,900000000000207008,900000000000074008
224360005,Number of previous jobs (observable entity),20020131,1,900000000000207008,900000000000074008
224361009,Type of job (observable entity),20020131,1,900000000000207008,900000000000074008
224362002,Employment status (observable entity),20020131,1,900000000000207008,900000000000074008
224326003,Qualifications achieved (observable entity),20020131,1,900000000000207008,900000000000074008
224329005,Legal affairs and legal constraints (observable entity),20020131,1,900000000000207008,900000000000074008
224391004,Acceptance of authority at work (observable entity),20020131,1,900000000000207008,900000000000074008
224394007,Acceptance of supervision at work (observable entity),20020131,1,900000000000207008,900000000000074008
224399002,Attendance at work (observable entity),20020131,1,900000000000207008,900000000000074008
224406003,Details relating to place of work and employer (observable entity),20020131,1,900000000000207008,900000000000074008
224388004,Awareness of safety at work (observable entity),20020131,1,900000000000207008,900000000000074008
224373009,Length of time in job (observable entity),20020131,1,900000000000207008,900000000000074008
224374003,Regularity of work (observable entity),20020131,1,900000000000207008,900000000000074008
224377005,Number of jobs at once (observable entity),20020131,1,900000000000207008,900000000000074008
224494008,Availability of informal caregiver (observable entity),20020131,1,900000000000207008,900000000000074008
224522000,Countries planned to visit (observable entity),20020131,1,900000000000207008,900000000000074008
224523005,Number of dependants (observable entity),20020131,1,900000000000207008,900000000000074008
224524004,Number of dependants in household (observable entity),20020131,1,900000000000207008,900000000000074008
224525003,Number in household (observable entity),20020131,1,900000000000207008,900000000000074008
224514007,Caregiver transport (observable entity),20020131,1,900000000000207008,900000000000074008
224497001,Proximity of informal caregiver (observable entity),20020131,1,900000000000207008,900000000000074008
224502004,Number of informal caregivers (observable entity),20020131,1,900000000000207008,900000000000074008
224503009,Quality of informal care (observable entity),20020131,1,900000000000207008,900000000000074008
224507005,Neighborhood care support (observable entity),20020131,1,900000000000207008,900000000000074008
224511004,Support for informal caregiver (observable entity),20020131,1,900000000000207008,900000000000074008
225597007,Ability to interact with others (observable entity),20020131,1,900000000000207008,900000000000074008
225598002,Interaction with others (observable entity),20020131,1,900000000000207008,900000000000074008
225567004,Appearance of cornea (observable entity),20020131,1,900000000000207008,900000000000074008
225568009,General appearance of eye (observable entity),20020131,1,900000000000207008,900000000000074008
225487001,Self-confidence (observable entity),20020131,1,900000000000207008,900000000000074008
225490007,Use of 'I' statements (observable entity),20020131,1,900000000000207008,900000000000074008
225464009,Attitude (observable entity),20020131,1,900000000000207008,900000000000074008
225467002,Volition (observable entity),20020131,1,900000000000207008,900000000000074008
225510008,Self-image (observable entity),20020131,1,900000000000207008,900000000000074008
225517006,Sexual partners (observable entity),20020131,1,900000000000207008,900000000000074008
225781004,Pain tolerance level (observable entity),20020131,1,900000000000207008,900000000000074008
225847002,Ability to talk about problems (observable entity),20020131,1,900000000000207008,900000000000074008
225810002,Vulnerability to exploitation (observable entity),20020131,1,900000000000207008,900000000000074008
224324000,Number of pupils in class (observable entity),20020131,1,900000000000207008,900000000000074008
225044005,General immune status (observable entity),20020131,1,900000000000207008,900000000000074008
224323006,Number of pupils in school (observable entity),20020131,1,900000000000207008,900000000000074008
225850004,Awareness of rules and boundaries (observable entity),20020131,1,900000000000207008,900000000000074008
224093006,Details of family (observable entity),20020131,1,900000000000207008,900000000000074008
224095004,Number of siblings (observable entity),20020131,1,900000000000207008,900000000000074008
224096003,Number of brothers (observable entity),20020131,1,900000000000207008,900000000000074008
224097007,Number of sisters (observable entity),20020131,1,900000000000207008,900000000000074008
224099005,Type of upbringing (observable entity),20020131,1,900000000000207008,900000000000074008
224098002,Place in family order (observable entity),20020131,1,900000000000207008,900000000000074008
224086007,Details of relatives (observable entity),20020131,1,900000000000207008,900000000000074008
224085006,Family details / household composition (observable entity),20020131,1,900000000000207008,900000000000074008
224084005,Number of previous marriages (observable entity),20020131,1,900000000000207008,900000000000074008
224075005,Mother tongue (observable entity),20020131,1,900000000000207008,900000000000074008
224076006,First language (observable entity),20020131,1,900000000000207008,900000000000074008
224077002,Second language (observable entity),20020131,1,900000000000207008,900000000000074008
224083004,Marital or partnership status (observable entity),20020131,1,900000000000207008,900000000000074008
224130005,Household composition (observable entity),20020131,1,900000000000207008,900000000000074008
224111005,Details of parents (observable entity),20020131,1,900000000000207008,900000000000074008
224112003,Age of parents (observable entity),20020131,1,900000000000207008,900000000000074008
224117009,Details of own children (observable entity),20020131,1,900000000000207008,900000000000074008
224118004,Number of offspring (observable entity),20020131,1,900000000000207008,900000000000074008
224119007,Age spread of children in family (observable entity),20020131,1,900000000000207008,900000000000074008
224150009,Pet ownership (observable entity),20020131,1,900000000000207008,900000000000074008
224261007,State of repair of house (observable entity),20020131,1,900000000000207008,900000000000074008
224263005,Adequacy of living space (observable entity),20020131,1,900000000000207008,900000000000074008
224265003,Personalization of home (observable entity),20020131,1,900000000000207008,900000000000074008
224268001,Cleanliness of home (observable entity),20020131,1,900000000000207008,900000000000074008
224272002,Tidiness of home (observable entity),20020131,1,900000000000207008,900000000000074008
224275000,Decoration of home (observable entity),20020131,1,900000000000207008,900000000000074008
224238005,Status of waiting list for accommodation (observable entity),20020131,1,900000000000207008,900000000000074008
224242008,Presence of communal areas in accommodation (observable entity),20020131,1,900000000000207008,900000000000074008
224245005,Opportunity for privacy in accommodation (observable entity),20020131,1,900000000000207008,900000000000074008
224249004,Characteristics of home environment (observable entity),20020131,1,900000000000207008,900000000000074008
224278003,Domestic facilities (observable entity),20020131,1,900000000000207008,900000000000074008
224303005,Education currently received (observable entity),20020131,1,900000000000207008,900000000000074008
224312007,Number of changes of school (observable entity),20020131,1,900000000000207008,900000000000074008
224314008,Degree of integration into mainstream education (observable entity),20020131,1,900000000000207008,900000000000074008
224279006,Details of telephone in the home (observable entity),20020131,1,900000000000207008,900000000000074008
224285004,Education and schooling detail (observable entity),20020131,1,900000000000207008,900000000000074008
224286003,Age at starting school (observable entity),20020131,1,900000000000207008,900000000000074008
224287007,Age at leaving school (observable entity),20020131,1,900000000000207008,900000000000074008
224288002,Duration of formal education (observable entity),20020131,1,900000000000207008,900000000000074008
224289005,Degree of interruption to education (observable entity),20020131,1,900000000000207008,900000000000074008
224293004,Education received in the past (observable entity),20020131,1,900000000000207008,900000000000074008
224235008,Eligibility for accommodation (observable entity),20020131,1,900000000000207008,900000000000074008
224178005,Frequency of payment of income (observable entity),20020131,1,900000000000207008,900000000000074008
224185009,Pattern of income (observable entity),20020131,1,900000000000207008,900000000000074008
224189003,Sufficiency of income for needs (observable entity),20020131,1,900000000000207008,900000000000074008
224173001,Individual income (observable entity),20020131,1,900000000000207008,900000000000074008
224153006,Local environment and neighborhood details (observable entity),20020131,1,900000000000207008,900000000000074008
224154000,Relationship with neighbors (observable entity),20020131,1,900000000000207008,900000000000074008
224155004,Details of local facilities and amenities (observable entity),20020131,1,900000000000207008,900000000000074008
224156003,State of public utilities and amenities (observable entity),20020131,1,900000000000207008,900000000000074008
224164009,Financial circumstances (observable entity),20020131,1,900000000000207008,900000000000074008
224167002,Income details (observable entity),20020131,1,900000000000207008,900000000000074008
224168007,Household income (observable entity),20020131,1,900000000000207008,900000000000074008
224192004,Benefit status (observable entity),20020131,1,900000000000207008,900000000000074008
224230003,Temporary shelter arrangements (observable entity),20020131,1,900000000000207008,900000000000074008
224193009,Entitlement to benefit status (observable entity),20020131,1,900000000000207008,900000000000074008
224200006,Management of financial affairs (observable entity),20020131,1,900000000000207008,900000000000074008
224203008,Use of banks and building societies (observable entity),20020131,1,900000000000207008,900000000000074008
224209007,Residence and accommodation circumstances (observable entity),20020131,1,900000000000207008,900000000000074008
224210002,Housing ownership and tenure (observable entity),20020131,1,900000000000207008,900000000000074008
228134009,School attendance (observable entity),20020131,1,900000000000207008,900000000000074008
228130000,Access to child (observable entity),20020131,1,900000000000207008,900000000000074008
228127007,Wardship (observable entity),20020131,1,900000000000207008,900000000000074008
228844008,Wedge filter angle (observable entity),20020131,1,900000000000207008,900000000000074008
228845009,Brachytherapy treatment parameters (observable entity),20020131,1,900000000000207008,900000000000074008
228846005,Brachytherapy radiation source strength (observable entity),20020131,1,900000000000207008,900000000000074008
228847001,Number of radioactive sources (observable entity),20020131,1,900000000000207008,900000000000074008
228848006,Brachytherapy radiation dose rate (observable entity),20020131,1,900000000000207008,900000000000074008
228849003,Brachytherapy radiation dose (observable entity),20020131,1,900000000000207008,900000000000074008
228850003,Total reference air kerma (observable entity),20020131,1,900000000000207008,900000000000074008
228851004,Reference point dose (observable entity),20020131,1,900000000000207008,900000000000074008
228852006,Nominal uterine body dose (observable entity),20020131,1,900000000000207008,900000000000074008
228853001,Radiation treating distance (observable entity),20020131,1,900000000000207008,900000000000074008
228854007,Radionuclide therapy parameters (observable entity),20020131,1,900000000000207008,900000000000074008
228855008,Radionuclide source activity (observable entity),20020131,1,900000000000207008,900000000000074008
228856009,Radionuclide dose (observable entity),20020131,1,900000000000207008,900000000000074008
228857000,Radionuclide uptake (observable entity),20020131,1,900000000000207008,900000000000074008
228858005,Pre-treatment uptake (observable entity),20020131,1,900000000000207008,900000000000074008
228859002,Radiation therapy observable (observable entity),20020131,1,900000000000207008,900000000000074008
228860007,Nominal standard dose (observable entity),20020131,1,900000000000207008,900000000000074008
228843002,Thickness of surface bolus (observable entity),20020131,1,900000000000207008,900000000000074008
228861006,Number of radiotherapy applications (observable entity),20020131,1,900000000000207008,900000000000074008
228842007,Thickness of cutout (observable entity),20020131,1,900000000000207008,900000000000074008
228840004,Radiotherapy beam modifier dimensions (observable entity),20020131,1,900000000000207008,900000000000074008
228823008,Reduced focus skin distance (observable entity),20020131,1,900000000000207008,900000000000074008
228824002,Source axis distance (observable entity),20020131,1,900000000000207008,900000000000074008
228825001,External beam radiation therapy pin height (observable entity),20020131,1,900000000000207008,900000000000074008
228826000,External beam radiation therapy height above couch (observable entity),20020131,1,900000000000207008,900000000000074008
228827009,Isocenter couch distance (observable entity),20020131,1,900000000000207008,900000000000074008
228828004,External beam radiation therapy setup angles (observable entity),20020131,1,900000000000207008,900000000000074008
228829007,Gantry angle (observable entity),20020131,1,900000000000207008,900000000000074008
228830002,Tilt angle (observable entity),20020131,1,900000000000207008,900000000000074008
228831003,Tangential angle (observable entity),20020131,1,900000000000207008,900000000000074008
228832005,Couch angle (observable entity),20020131,1,900000000000207008,900000000000074008
228833000,Jaw angle (observable entity),20020131,1,900000000000207008,900000000000074008
228834006,Beam angle (observable entity),20020131,1,900000000000207008,900000000000074008
228835007,Wedge angle (observable entity),20020131,1,900000000000207008,900000000000074008
228836008,Hinge angle (observable entity),20020131,1,900000000000207008,900000000000074008
228837004,Rotation external beam radiation therapy parameters (observable entity),20020131,1,900000000000207008,900000000000074008
228838009,Number of arcs (observable entity),20020131,1,900000000000207008,900000000000074008
228839001,Number of centers (observable entity),20020131,1,900000000000207008,900000000000074008
228841000,Thickness of block (observable entity),20020131,1,900000000000207008,900000000000074008
228822003,Extended focus skin distance (observable entity),20020131,1,900000000000207008,900000000000074008
228862004,Number of fractions (observable entity),20020131,1,900000000000207008,900000000000074008
228863009,Number of exposures (observable entity),20020131,1,900000000000207008,900000000000074008
228865002,Brachytherapy source activity (observable entity),20020131,1,900000000000207008,900000000000074008
228867005,High dose rate brachytherapy (observable entity),20020131,1,900000000000207008,900000000000074008
228868000,Low dose rate brachytherapy (observable entity),20020131,1,900000000000207008,900000000000074008
228821005,Standard focus skin distance (observable entity),20020131,1,900000000000207008,900000000000074008
228819000,External beam radiation therapy setup distances (observable entity),20020131,1,900000000000207008,900000000000074008
228820006,Source skin distance (observable entity),20020131,1,900000000000207008,900000000000074008
228779000,Radiotherapy parameter (observable entity),20020131,1,900000000000207008,900000000000074008
228802002,Length of external beam radiation therapy beam (observable entity),20020131,1,900000000000207008,900000000000074008
228803007,External beam radiation therapy dose parameters (observable entity),20020131,1,900000000000207008,900000000000074008
228804001,External beam radiation therapy radiation dose specification (observable entity),20020131,1,900000000000207008,900000000000074008
228805000,Maximum radiation target dose (observable entity),20020131,1,900000000000207008,900000000000074008
228807008,Minimum radiation target dose (observable entity),20020131,1,900000000000207008,900000000000074008
228808003,Modal radiation target dose (observable entity),20020131,1,900000000000207008,900000000000074008
228809006,Mean radiation target dose (observable entity),20020131,1,900000000000207008,900000000000074008
228810001,Maximum radiation tissue dose (observable entity),20020131,1,900000000000207008,900000000000074008
228811002,Target radiation absorbed dose (observable entity),20020131,1,900000000000207008,900000000000074008
228812009,Critical radiation tissue dose (observable entity),20020131,1,900000000000207008,900000000000074008
228813004,Intersection radiation dose (observable entity),20020131,1,900000000000207008,900000000000074008
228814005,Mid-plane radiation dose (observable entity),20020131,1,900000000000207008,900000000000074008
228815006,Incident radiation dose (observable entity),20020131,1,900000000000207008,900000000000074008
228816007,Percentage depth dose (observable entity),20020131,1,900000000000207008,900000000000074008
228817003,External beam radiation therapy monitor units (observable entity),20020131,1,900000000000207008,900000000000074008
228818008,External beam radiation therapy setup parameters (observable entity),20020131,1,900000000000207008,900000000000074008
228801009,Width of external beam radiation therapy beam (observable entity),20020131,1,900000000000207008,900000000000074008
228800005,Depth of external beam radiation therapy beam (observable entity),20020131,1,900000000000207008,900000000000074008
228798003,Diameter of irradiated volume (observable entity),20020131,1,900000000000207008,900000000000074008
228780002,External beam radiation therapy treatment parameters (observable entity),20020131,1,900000000000207008,900000000000074008
228781003,External beam radiation therapy beam energy (observable entity),20020131,1,900000000000207008,900000000000074008
228782005,Radiation half-value thickness (observable entity),20020131,1,900000000000207008,900000000000074008
228784006,External beam radiation therapy dose rate (observable entity),20020131,1,900000000000207008,900000000000074008
228788009,Field separation (observable entity),20020131,1,900000000000207008,900000000000074008
228789001,External beam radiation therapy volume parameters (observable entity),20020131,1,900000000000207008,900000000000074008
228790005,Irradiated volume (observable entity),20020131,1,900000000000207008,900000000000074008
228791009,Gross tumor volume (observable entity),20020131,1,900000000000207008,900000000000074008
228792002,Clinical target volume (observable entity),20020131,1,900000000000207008,900000000000074008
228793007,Planning target volume (observable entity),20020131,1,900000000000207008,900000000000074008
228794001,Irradiated volume dimensions (observable entity),20020131,1,900000000000207008,900000000000074008
228795000,Depth of irradiated volume (observable entity),20020131,1,900000000000207008,900000000000074008
228796004,Width of irradiated volume (observable entity),20020131,1,900000000000207008,900000000000074008
228797008,Length of irradiated volume (observable entity),20020131,1,900000000000207008,900000000000074008
228799006,External beam radiation therapy beam dimensions (observable entity),20020131,1,900000000000207008,900000000000074008
228272008,Health-related behavior (observable entity),20020131,1,900000000000207008,900000000000074008
228283004,Drinking environment (observable entity),20020131,1,900000000000207008,900000000000074008
228282009,Drinking habits (observable entity),20020131,1,900000000000207008,900000000000074008
228328008,Age at starting drinking (observable entity),20020131,1,900000000000207008,900000000000074008
228329000,Time since stopped drinking (observable entity),20020131,1,900000000000207008,900000000000074008
228330005,Total time drunk alcohol (observable entity),20020131,1,900000000000207008,900000000000074008
228331009,Priority of drink-related activities (observable entity),20020131,1,900000000000207008,900000000000074008
228296003,Company when drinking (observable entity),20020131,1,900000000000207008,900000000000074008
228308009,Pattern of drinking (observable entity),20020131,1,900000000000207008,900000000000074008
228309001,Pattern of drinking through day (observable entity),20020131,1,900000000000207008,900000000000074008
228311005,Pattern of alcohol consumption through week (observable entity),20020131,1,900000000000207008,900000000000074008
228163007,Receipt of benefit status (observable entity),20020131,1,900000000000207008,900000000000074008
228338003,Ability to control drinking (observable entity),20020131,1,900000000000207008,900000000000074008
228466005,Commitment to sexual relationship (observable entity),20020131,1,900000000000207008,900000000000074008
228470002,Orientation of sexual relationship (observable entity),20020131,1,900000000000207008,900000000000074008
228473000,Duration of sexual relationship (observable entity),20020131,1,900000000000207008,900000000000074008
228476008,Use of protection for sex (observable entity),20020131,1,900000000000207008,900000000000074008
228465009,Sexual relationship details (observable entity),20020131,1,900000000000207008,900000000000074008
228464008,Number of sexual partners in past 5 years (observable entity),20020131,1,900000000000207008,900000000000074008
228462007,Total number of sexual partners ever (observable entity),20020131,1,900000000000207008,900000000000074008
228449008,Frequency of exercise (observable entity),20020131,1,900000000000207008,900000000000074008
228450008,Time spent exercising (observable entity),20020131,1,900000000000207008,900000000000074008
228454004,Frequency of sex (observable entity),20020131,1,900000000000207008,900000000000074008
228455003,Time since stopped being sexually active (observable entity),20020131,1,900000000000207008,900000000000074008
228456002,Age became sexually active (observable entity),20020131,1,900000000000207008,900000000000074008
228457006,Total time sexually active (observable entity),20020131,1,900000000000207008,900000000000074008
228458001,Number of sexual partners (observable entity),20020131,1,900000000000207008,900000000000074008
228459009,Number of current sexual partners (observable entity),20020131,1,900000000000207008,900000000000074008
228463002,Number of sexual partners in past year (observable entity),20020131,1,900000000000207008,900000000000074008
228489002,Snuff use (observable entity),20020131,1,900000000000207008,900000000000074008
228519008,Frequency of chewing tobacco (observable entity),20020131,1,900000000000207008,900000000000074008
228520002,Time since stopped chewing tobacco (observable entity),20020131,1,900000000000207008,900000000000074008
228521003,Total time chewed tobacco (observable entity),20020131,1,900000000000207008,900000000000074008
