id,label,effectiveTime,active,moduleId,definitionStatusId
448003001,Royal College of Physicians 3 questions score (observable entity),20110731,1,900000000000207008,900000000000074008
447754009,Number of procedure attempts (observable entity),20110731,1,900000000000207008,900000000000074008
447715008,Chronic respiratory disease questionnaire score (observable entity),20110731,1,900000000000207008,900000000000074008
448755007,Tobacco smokefree home (observable entity),20110731,1,900000000000207008,900000000000074008
448886007,Time from call for help to patient arrival at facility (observable entity),20110731,1,900000000000207008,900000000000074008
448885006,Time from arrival at facility to administration of parenteral treatment (observable entity),20110731,1,900000000000207008,900000000000074008
448878007,Time from onset of pain to call for help (observable entity),20110731,1,900000000000207008,900000000000074008
448906006,Time from onset of pain to administration of thrombolytic agent (observable entity),20110731,1,900000000000207008,900000000000074008
449302007,Readiness for transport (observable entity),20110731,1,900000000000207008,900000000000074008
449361003,Pattern of weight gain (observable entity),20110731,1,900000000000207008,900000000000074008
449331006,Date of last sexual intercourse (observable entity),20110731,1,900000000000207008,900000000000074008
450324005,Obsessive compulsive inventory score (observable entity),20120731,1,900000000000207008,900000000000074008
450326007,Panic disorder severity scale score (observable entity),20120731,1,900000000000207008,900000000000074008
450359005,Benign prostatic hyperplasia impact index score (observable entity),20120731,1,900000000000207008,900000000000074008
450360000,Coronary artery calcium score (observable entity),20120731,1,900000000000207008,900000000000074008
450755002,Medical Research Council Dyspnoea scale score (observable entity),20120731,1,900000000000207008,900000000000074008
450758000,Voice handicap index score (observable entity),20120731,1,900000000000207008,900000000000074008
450728006,Impact of event scale revised score (observable entity),20120731,1,900000000000207008,900000000000074008
450317009,Strengths and difficulties questionnaire score (observable entity),20120731,1,900000000000207008,900000000000074008
450320001,Edinburgh postnatal depression scale score (observable entity),20120731,1,900000000000207008,900000000000074008
450743008,National Institutes of Health stroke scale score (observable entity),20120731,1,900000000000207008,900000000000074008
450747009,Saint George's respiratory questionnaire score (observable entity),20120731,1,900000000000207008,900000000000074008
450735003,Housing dependency scale score (observable entity),20120731,1,900000000000207008,900000000000074008
450979009,Sensory modality assessment and rehabilitation technique score (observable entity),20120731,1,900000000000207008,900000000000074008
473333005,Chronic respiratory disease questionnaire mastery subscale score (observable entity),20130131,1,900000000000207008,900000000000074008
473332000,Chronic respiratory disease questionnaire fatigue subscale score (observable entity),20130131,1,900000000000207008,900000000000074008
473331007,Chronic respiratory disease questionnaire emotional function subscale score (observable entity),20130131,1,900000000000207008,900000000000074008
473330008,Chronic respiratory disease questionnaire dyspnea subscale score (observable entity),20130131,1,900000000000207008,900000000000074008
473329003,Chronic respiratory disease questionnaire observable (observable entity),20130131,1,900000000000207008,900000000000074008
473355002,Mobility inventory for agoraphobia when alone score (observable entity),20130131,1,900000000000207008,900000000000074008
473354003,Mobility inventory for agoraphobia when accompanied score (observable entity),20130131,1,900000000000207008,900000000000074008
473346000,Eating disorder examination questionnaire shape concern subscale score (observable entity),20130131,1,900000000000207008,900000000000074008
473345001,Eating disorder examination questionnaire eating concern subscale score (observable entity),20130131,1,900000000000207008,900000000000074008
473344002,Eating disorder examination questionnaire observable (observable entity),20130131,1,900000000000207008,900000000000074008
473347009,Eating disorder examination questionnaire weight concern subscale score (observable entity),20130131,1,900000000000207008,900000000000074008
473353009,Standing-start 180 degree turn test number of steps (observable entity),20130131,1,900000000000207008,900000000000074008
473348004,Eating disorder examination questionnaire restraint subscale score (observable entity),20130131,1,900000000000207008,900000000000074008
473296001,Psychotic symptom rating scales delusions subscale emotional characteristics score (observable entity),20130131,1,900000000000207008,900000000000074008
473295002,Psychotic symptom rating scales delusions subscale score (observable entity),20130131,1,900000000000207008,900000000000074008
473294003,Psychotic symptom rating scales delusions subscale cognitive interpretation score (observable entity),20130131,1,900000000000207008,900000000000074008
473293009,Psychotic symptom rating scales auditory hallucination subscale score (observable entity),20130131,1,900000000000207008,900000000000074008
473292004,Psychotic symptom rating scales auditory hallucination subscale emotional characteristics score (observable entity),20130131,1,900000000000207008,900000000000074008
473291006,Psychotic symptom rating scales auditory hallucination subscale physical characteristics score (observable entity),20130131,1,900000000000207008,900000000000074008
473290007,Psychotic symptom rating scales auditory hallucination subscale cognitive interpretation score (observable entity),20130131,1,900000000000207008,900000000000074008
473289003,Psychotic symptom rating scales observable (observable entity),20130131,1,900000000000207008,900000000000074008
699232007,Disabilities of the arm shoulder and hand outcome measurement sports/performing arts module score (observable entity),20140131,1,900000000000207008,900000000000074008
699250000,Fetal diagnosis (observable entity),20140131,1,900000000000207008,900000000000074008
699863002,Maxilla residual ridge observable (observable entity),20140131,1,900000000000207008,900000000000074008
699666008,Keratometry flat axis (observable entity),20140131,1,900000000000207008,900000000000074008
699664006,Keratometry flat power (observable entity),20140131,1,900000000000207008,900000000000074008
699663000,Keratometry steep axis (observable entity),20140131,1,900000000000207008,900000000000074008
699662005,Keratometry steep power (observable entity),20140131,1,900000000000207008,900000000000074008
698828003,Circulatory arrest time (observable entity),20140131,1,900000000000207008,900000000000074008
698824001,Expiratory tidal volume (observable entity),20140131,1,900000000000207008,900000000000074008
698823007,Inspiratory tidal volume (observable entity),20140131,1,900000000000207008,900000000000074008
698822002,Airway plateau pressure (observable entity),20140131,1,900000000000207008,900000000000074008
698821009,Mean inspiratory airway pressure (observable entity),20140131,1,900000000000207008,900000000000074008
698830001,Oxygen concentration at common gas outlet (observable entity),20140131,1,900000000000207008,900000000000074008
699092002,Spirometric lung age (observable entity),20140131,1,900000000000207008,900000000000074008
699089001,Social wellbeing (observable entity),20140131,1,900000000000207008,900000000000074008
699087004,Social phobia inventory avoidance subscore (observable entity),20140131,1,900000000000207008,900000000000074008
699086008,Social phobia inventory fear subscore (observable entity),20140131,1,900000000000207008,900000000000074008
699085007,Social phobia inventory physical symptoms subscore (observable entity),20140131,1,900000000000207008,900000000000074008
699047009,Duration of antiplatelet therapy (observable entity),20140131,1,900000000000207008,900000000000074008
699095000,Marks and Mathews fear questionnaire total social phobia score (observable entity),20140131,1,900000000000207008,900000000000074008
699097008,Marks and Mathews fear questionnaire total agoraphobia score (observable entity),20140131,1,900000000000207008,900000000000074008
699096004,Marks and Mathews fear questionnaire total blood injury phobia score (observable entity),20140131,1,900000000000207008,900000000000074008
699113009,Expiratory positive airway pressure (observable entity),20140131,1,900000000000207008,900000000000074008
699100003,"Historical, clinical, risk management 20 assessing risk for violence scheme version 2 clinical subscore (observable entity)",20140131,1,900000000000207008,900000000000074008
699099006,"Historical, clinical, risk management 20 assessing risk for violence scheme version 2 historical subscore (observable entity)",20140131,1,900000000000207008,900000000000074008
699098003,"Historical, clinical, risk management 20 assessing risk for violence scheme version 2 risk management subscore (observable entity)",20140131,1,900000000000207008,900000000000074008
702534005,Forced expiratory volume in one second/Forced expiratory volume in six seconds ratio (observable entity),20140731,1,900000000000207008,900000000000074008
703503000,Name (observable entity),20140731,1,900000000000207008,900000000000074008
703502005,Glomerular filtration of creatinine (observable entity),20140731,1,900000000000207008,900000000000074008
703065002,Specimen source (observable entity),20140731,1,900000000000207008,900000000000074008
703421000,Temperature (observable entity),20140731,1,900000000000207008,900000000000074008
703247007,Color (observable entity),20140731,1,900000000000207008,900000000000074008
703248002,Appearance (observable entity),20140731,1,900000000000207008,900000000000074008
703489001,Anogenital distance (observable entity),20140731,1,900000000000207008,900000000000074008
702748008,Number of occurrences observable (observable entity),20140731,1,900000000000207008,900000000000074008
700484007,Ability to self manage symptoms (observable entity),20140731,1,900000000000207008,900000000000074008
700501004,DoloTest profile (observable entity),20140731,1,900000000000207008,900000000000074008
700457006,Frequency of blood ketone self-monitoring (observable entity),20140731,1,900000000000207008,900000000000074008
700466005,DoloTest score (observable entity),20140731,1,900000000000207008,900000000000074008
700469003,Frequency of pain symptom (observable entity),20140731,1,900000000000207008,900000000000074008
700471003,Level of nausea (observable entity),20140731,1,900000000000207008,900000000000074008
446763002,Eating disorder examination global score (observable entity),20140731,1,900000000000207008,900000000000074008
1221000175102,Age at smoking cessation (observable entity),20150131,1,900000000000207008,900000000000074008
651000124106,Peritoneal dialysis prescription compliance (observable entity),20150131,1,900000000000207008,900000000000074008
1421000175103,Readiness to stop tobacco use (observable entity),20150131,1,900000000000207008,900000000000074008
1431000175100,Tobacco cessation treatment history (observable entity),20150131,1,900000000000207008,900000000000074008
2801000175104,Hours per day playing games on a screen (observable entity),20150131,1,900000000000207008,900000000000074008
2811000175101,Hours per day watching television or videos (observable entity),20150131,1,900000000000207008,900000000000074008
351000124102,Prescription observable (observable entity),20150131,1,900000000000207008,900000000000074008
707285009,One leg stand test time (observable entity),20150131,1,900000000000207008,900000000000074008
708507001,Diastolic blood pressure of neonate at birth (observable entity),20150131,1,900000000000207008,900000000000074008
708509003,Maxillary incisor display (observable entity),20150131,1,900000000000207008,900000000000074008
708499008,Core body temperature of neonate at birth (observable entity),20150131,1,900000000000207008,900000000000074008
708502007,Systolic blood pressure of neonate at birth (observable entity),20150131,1,900000000000207008,900000000000074008
707738004,Lower limb length discrepancy (observable entity),20150131,1,900000000000207008,900000000000074008
704122005,Contraception method of partner (observable entity),20150131,1,900000000000207008,900000000000074008
704393002,Attitude towards care (observable entity),20150131,1,900000000000207008,900000000000074008
704394008,Attitude towards dietary regime (observable entity),20150131,1,900000000000207008,900000000000074008
704395009,Attitude towards exercise (observable entity),20150131,1,900000000000207008,900000000000074008
704396005,Attitude towards medication management (observable entity),20150131,1,900000000000207008,900000000000074008
704397001,Attitude towards treatment (observable entity),20150131,1,900000000000207008,900000000000074008
704207005,Frequency of angina (observable entity),20150131,1,900000000000207008,900000000000074008
705074003,Ability to see (observable entity),20150131,1,900000000000207008,900000000000074008
705048009,Ability to self monitor disease (observable entity),20150131,1,900000000000207008,900000000000074008
705096009,Deep symmetric anterior T wave inversion (finding),20150131,1,900000000000207008,900000000000074008
705035005,Lymphedema quality of life tool (leg) score (observable entity),20150131,1,900000000000207008,900000000000074008
705036006,Lymphedema quality of life tool (arm) score (observable entity),20150131,1,900000000000207008,900000000000074008
705037002,Hypomania checklist 32 item revised score (observable entity),20150131,1,900000000000207008,900000000000074008
705023006,Born in Democratic Republic of Congo (finding),20150131,1,900000000000207008,900000000000074008
706952004,Disabilities of the arm shoulder and hand outcome measure work module score (observable entity),20150131,1,900000000000207008,900000000000074008
710108006,Length of body of mandible (observable entity),20150731,1,900000000000207008,900000000000074008
710111007,Range of hallux dorsiflexion (observable entity),20150731,1,900000000000207008,900000000000074008
710001002,Tooth number (observable entity),20150731,1,900000000000207008,900000000000074008
710004005,Retruded to maximum intercuspation (observable entity),20150731,1,900000000000207008,900000000000074008
710764000,Edentulous maxillomandibular relationship (observable entity),20150731,1,900000000000207008,900000000000074008
710793000,Cant of occlusal plane (observable entity),20150731,1,900000000000207008,900000000000074008
710801003,Width of periodontal ligament (observable entity),20150731,1,900000000000207008,900000000000074008
710800002,Width of molar tooth (observable entity),20150731,1,900000000000207008,900000000000074008
710799001,Width of canine tooth (observable entity),20150731,1,900000000000207008,900000000000074008
708675002,Gonial angle (observable entity),20150731,1,900000000000207008,900000000000074008
708685001,Mandibular plane angle (observable entity),20150731,1,900000000000207008,900000000000074008
709463006,Root number (observable entity),20150731,1,900000000000207008,900000000000074008
709007004,Compliance behavior to therapeutic regimen (observable entity),20150731,1,900000000000207008,900000000000074008
709015001,Compliance behavior to medical regimen (observable entity),20150731,1,900000000000207008,900000000000074008
709016000,Compliance behavior to fluid volume regime (observable entity),20150731,1,900000000000207008,900000000000074008
709017009,Compliance behavior to safety precaution (observable entity),20150731,1,900000000000207008,900000000000074008
708896007,Deauville five point scale score (observable entity),20150731,1,900000000000207008,900000000000074008
3411000175108,Total number of postpartum care visits (observable entity),20150731,1,900000000000207008,900000000000074008
3401000175105,Total number of prenatal care visits (observable entity),20150731,1,900000000000207008,900000000000074008
2781000175103,"Video, television or computer screen time (observable entity)",20150731,1,900000000000207008,900000000000074008
3941000175104,Birth abdominal circumference (observable entity),20150731,1,900000000000207008,900000000000074008
3931000175105,Birth chest circumference (observable entity),20150731,1,900000000000207008,900000000000074008
3921000175107,Patient written birth plan location (observable entity),20150731,1,900000000000207008,900000000000074008
4061000175103,Date of last foot examination (observable entity),20150731,1,900000000000207008,900000000000074008
711464005,Lower anterior face height (observable entity),20150731,1,900000000000207008,900000000000074008
711468008,Tooth crown to root ratio (observable entity),20150731,1,900000000000207008,900000000000074008
711462009,Posterior face height (observable entity),20150731,1,900000000000207008,900000000000074008
711459006,Lower face height (observable entity),20150731,1,900000000000207008,900000000000074008
712495001,Health of partner (observable entity),20150731,1,900000000000207008,900000000000074008
711562006,Body position for feeding (observable entity),20150731,1,900000000000207008,900000000000074008
711559008,Domestic violence screening interpretation (observable entity),20150731,1,900000000000207008,900000000000074008
711585007,Length of ramus of mandible (observable entity),20150731,1,900000000000207008,900000000000074008
711583000,Upper anterior face height (observable entity),20150731,1,900000000000207008,900000000000074008
711582005,Anterior face height (observable entity),20150731,1,900000000000207008,900000000000074008
711558000,Angle between lower incisor tooth and mandibular plane (observable entity),20150731,1,900000000000207008,900000000000074008
713556009,Form of natal cleft (observable entity),20160131,1,900000000000207008,900000000000074008
713521005,Concentration of sperm (observable entity),20160131,1,900000000000207008,900000000000074008
713596006,Carer Support Needs Assessment Tool score (observable entity),20160131,1,900000000000207008,900000000000074008
713408000,Mini-Cog brief cognitive screening test score (observable entity),20160131,1,900000000000207008,900000000000074008
713931006,Ability to acculturate (observable entity),20160131,1,900000000000207008,900000000000074008
713660004,Ability to complete a sentence in one breath (observable entity),20160131,1,900000000000207008,900000000000074008
712814005,Date of last seizure (observable entity),20160131,1,900000000000207008,900000000000074008
713052001,Measure Yourself Medical Outcome Profile score (observable entity),20160131,1,900000000000207008,900000000000074008
271000124103,Medical reason for exclusion from performance measure (observable entity),20160131,1,900000000000207008,900000000000074008
281000124100,Patient reason for exclusion from performance measure (observable entity),20160131,1,900000000000207008,900000000000074008
291000124102,System reason for exclusion from performance measure (observable entity),20160131,1,900000000000207008,900000000000074008
491000124103,Clinical performance measure (observable entity),20160131,1,900000000000207008,900000000000074008
714151003,Environmental tobacco smoke exposure (observable entity),20160131,1,900000000000207008,900000000000074008
713981002,Ability to abstain from drinking (observable entity),20160131,1,900000000000207008,900000000000074008
713985006,Ability to adhere to rules and boundaries (observable entity),20160131,1,900000000000207008,900000000000074008
713986007,Ability to adjust to work situation (observable entity),20160131,1,900000000000207008,900000000000074008
713987003,Ability to agree with care plan (observable entity),20160131,1,900000000000207008,900000000000074008
714474007,Aachen Aphasia Test score (observable entity),20160131,1,900000000000207008,900000000000074008
714524007,Maxillary vestibule depth (observable entity),20160131,1,900000000000207008,900000000000074008
714525008,Mandibular vestibule depth (observable entity),20160131,1,900000000000207008,900000000000074008
714360001,Alzheimer's Disease Assessment Scale score (observable entity),20160131,1,900000000000207008,900000000000074008
717270009,Rutter A Scale score (observable entity),20160731,1,900000000000207008,900000000000074008
717229007,Communication Assessment Profile score (observable entity),20160731,1,900000000000207008,900000000000074008
717227009,Beck Hopelessness Scale score (observable entity),20160731,1,900000000000207008,900000000000074008
717288001,Zung self rating depression scale score (observable entity),20160731,1,900000000000207008,900000000000074008
3161000175102,Suicide risk (observable entity),20160731,1,900000000000207008,900000000000074008
716822001,Renfrew Word Finding Vocabulary Test score (observable entity),20160731,1,900000000000207008,900000000000074008
716824000,Mount Wilga High Level Language Test score (observable entity),20160731,1,900000000000207008,900000000000074008
716834009,Fullerton Language Test for Adolescents score (observable entity),20160731,1,900000000000207008,900000000000074008
716837002,Repertory Grid score (observable entity),20160731,1,900000000000207008,900000000000074008
716841003,Frenchay Dysarthria Assessment score (observable entity),20160731,1,900000000000207008,900000000000074008
716817001,Phonological assessment of child speech score (observable entity),20160731,1,900000000000207008,900000000000074008
716798001,Porch Index of Communicative Ability score (observable entity),20160731,1,900000000000207008,900000000000074008
716800008,Face Arm Speech Test score (observable entity),20160731,1,900000000000207008,900000000000074008
716802000,Discourse abilities profile score (observable entity),20160731,1,900000000000207008,900000000000074008
716804004,Pre-speech Assessment Scale score (observable entity),20160731,1,900000000000207008,900000000000074008
716806002,Fundamental speech skills test score (observable entity),20160731,1,900000000000207008,900000000000074008
716811000,Assessment Protocol of Pragmatic Linguistic Skills score (observable entity),20160731,1,900000000000207008,900000000000074008
716814008,Measurement of Cognitive Linguistic Ability score (observable entity),20160731,1,900000000000207008,900000000000074008
716845007,Bankson Language Test score (observable entity),20160731,1,900000000000207008,900000000000074008
716848009,Amsterdam-Nijmegen Everyday Language Test score (observable entity),20160731,1,900000000000207008,900000000000074008
716874003,Assessment of Intelligibility of Dysarthric Speech score (observable entity),20160731,1,900000000000207008,900000000000074008
716879008,Beck Anxiety Inventory score (observable entity),20160731,1,900000000000207008,900000000000074008
716882003,Consensus Auditory-Perceptual Evaluation of Voice score (observable entity),20160731,1,900000000000207008,900000000000074008
716883008,Behavioral Inattention Test score (observable entity),20160731,1,900000000000207008,900000000000074008
716847004,Multilevel Informal Language Inventory score (observable entity),20160731,1,900000000000207008,900000000000074008
716851002,Carrow Elicited Language Inventory score (observable entity),20160731,1,900000000000207008,900000000000074008
716853004,Wechsler Objective Language Dimensions test score (observable entity),20160731,1,900000000000207008,900000000000074008
716854005,Yale Swallow Protocol score (observable entity),20160731,1,900000000000207008,900000000000074008
717000003,Stocker Probe Technique score (observable entity),20160731,1,900000000000207008,900000000000074008
717015002,Developmental Dimensional and Diagnostic Interview score (observable entity),20160731,1,900000000000207008,900000000000074008
717037009,South Tyneside Assessment of Syntactic Structures score (observable entity),20160731,1,900000000000207008,900000000000074008
717038004,Test of Language Competence score (observable entity),20160731,1,900000000000207008,900000000000074008
717039007,Test of Word Knowledge score (observable entity),20160731,1,900000000000207008,900000000000074008
717034002,Diagnostic Interview for Children and Adolescents score (observable entity),20160731,1,900000000000207008,900000000000074008
717017005,Children's Communication Checklist Second Edition score (observable entity),20160731,1,900000000000207008,900000000000074008
718321009,Stuttering Severity Instrument for Children and Adults score (observable entity),20160731,1,900000000000207008,900000000000074008
718334005,Aston Index score (observable entity),20160731,1,900000000000207008,900000000000074008
718298009,Renfrew Bus Story score (observable entity),20160731,1,900000000000207008,900000000000074008
718300009,Bracken Basic Concept Scale: Expressive score (observable entity),20160731,1,900000000000207008,900000000000074008
718316006,Brief Assessment Schedule Depression Cards score (observable entity),20160731,1,900000000000207008,900000000000074008
718340003,Test of Word Finding in Discourse score (observable entity),20160731,1,900000000000207008,900000000000074008
718343001,Test of Syntactic Abilities score (observable entity),20160731,1,900000000000207008,900000000000074008
718377006,Pragmatics Profile score (observable entity),20160731,1,900000000000207008,900000000000074008
718379009,Acceptance of Illness Scale score (observable entity),20160731,1,900000000000207008,900000000000074008
718384003,Bayley Scales of Infant Development score (observable entity),20160731,1,900000000000207008,900000000000074008
718386001,Denver Development Screening Test score (observable entity),20160731,1,900000000000207008,900000000000074008
718387005,Symbol Digit Modalities Test score (observable entity),20160731,1,900000000000207008,900000000000074008
