id,label,effectiveTime,active,moduleId,definitionStatusId
266981003,Schooling (observable entity),20020131,1,900000000000207008,900000000000074008
267011001,Gynecological history (observable entity),20020131,1,900000000000207008,900000000000074008
266941005,Provision of domiciliary services (observable entity),20020131,1,900000000000207008,900000000000074008
266955002,Employment milestones (observable entity),20020131,1,900000000000207008,900000000000074008
267065001,Urine appearance (observable entity),20020131,1,900000000000207008,900000000000074008
267013003,Past pregnancy outcome (observable entity),20020131,1,900000000000207008,900000000000074008
267050002,Site of gastrointestinal tract pain (observable entity),20020131,1,900000000000207008,900000000000074008
266930008,Exercise history (observable entity),20020131,1,900000000000207008,900000000000074008
271306003,Best ever peak flow rate (respiratory) (observable entity),20020131,1,900000000000207008,900000000000074008
271391000,Provision of home help (observable entity),20020131,1,900000000000207008,900000000000074008
271397001,Menstrual data (observable entity),20020131,1,900000000000207008,900000000000074008
271624007,Method of breathing (observable entity),20020131,1,900000000000207008,900000000000074008
271626009,Depth of respiration (observable entity),20020131,1,900000000000207008,900000000000074008
271628005,Position of trachea (observable entity),20020131,1,900000000000207008,900000000000074008
271600004,Body form (observable entity),20020131,1,900000000000207008,900000000000074008
271603002,Height / growth measure (observable entity),20020131,1,900000000000207008,900000000000074008
271605009,Position of body and posture (observable entity),20020131,1,900000000000207008,900000000000074008
271619009,Quality of personal care shown by appearance (observable entity),20020131,1,900000000000207008,900000000000074008
271692001,Presentation of fetus (observable entity),20020131,1,900000000000207008,900000000000074008
271671001,Smell of breath (observable entity),20020131,1,900000000000207008,900000000000074008
271507006,Peak flow rate after bronchodilation (observable entity),20020131,1,900000000000207008,900000000000074008
271508001,Expected peak flow rate (respiratory) (observable entity),20020131,1,900000000000207008,900000000000074008
271562002,Total duration of labor (observable entity),20020131,1,900000000000207008,900000000000074008
271529005,Peak flow rate before bronchodilation (observable entity),20020131,1,900000000000207008,900000000000074008
269823000,Hemoglobin A1C - diabetic control interpretation (observable entity),20020131,1,900000000000207008,900000000000074008
269902007,Feces foreign constituent (observable entity),20020131,1,900000000000207008,900000000000074008
269903002,Feces pancreatic effects (observable entity),20020131,1,900000000000207008,900000000000074008
270477000,Type of gastrointestinal tract pain (observable entity),20020131,1,900000000000207008,900000000000074008
43260008,Hose diving (qualifier value),20020131,1,900000000000207008,900000000000074008
43224003,Pleural pressure (observable entity),20020131,1,900000000000207008,900000000000074008
43068009,Motherhood (observable entity),20020131,1,900000000000207008,900000000000074008
44432004,"Muscle tensile strength, function (observable entity)",20020131,1,900000000000207008,900000000000074008
44815009,Breslow measurement - greater than 1.75 mm (finding),20020131,1,900000000000207008,900000000000074008
44098006,Archery (qualifier value),20020131,1,900000000000207008,900000000000074008
41633001,Intraocular pressure (observable entity),20020131,1,900000000000207008,900000000000074008
41701000,Dark adaptation (observable entity),20020131,1,900000000000207008,900000000000074008
40909004,Regional lung volume (observable entity),20020131,1,900000000000207008,900000000000074008
41011002,T wave feature (observable entity),20020131,1,900000000000207008,900000000000074008
42457008,Residual respiratory volume (observable entity),20020131,1,900000000000207008,900000000000074008
42233006,"Muscle motor unit potential, function (observable entity)",20020131,1,900000000000207008,900000000000074008
42111002,Bladder function (observable entity),20020131,1,900000000000207008,900000000000074008
48761009,Motor behavior (observable entity),20020131,1,900000000000207008,900000000000074008
45500009,"Muscle innervation ratio, function (observable entity)",20020131,1,900000000000207008,900000000000074008
46470002,Barlow test response (observable entity),20020131,1,900000000000207008,900000000000074008
46649000,Close circuit scuba diving (qualifier value),20020131,1,900000000000207008,900000000000074008
35544009,Apley compression test response (observable entity),20020131,1,900000000000207008,900000000000074008
35706003,Isovolume pressure-flow curve (observable entity),20020131,1,900000000000207008,900000000000074008
35877002,S wave feature (observable entity),20020131,1,900000000000207008,900000000000074008
35897007,Active movement (observable entity),20020131,1,900000000000207008,900000000000074008
33405001,P wave feature (observable entity),20020131,1,900000000000207008,900000000000074008
34205009,Ejection (qualifier value),20020131,1,900000000000207008,900000000000074008
33957008,Personal dead space volume (observable entity),20020131,1,900000000000207008,900000000000074008
39211005,Bowel action (observable entity),20020131,1,900000000000207008,900000000000074008
39438000,U wave feature (observable entity),20020131,1,900000000000207008,900000000000074008
39599007,Snorkel diving (qualifier value),20020131,1,900000000000207008,900000000000074008
39146006,"Stress tolerance, function (observable entity)",20020131,1,900000000000207008,900000000000074008
40137007,Pupil light reflex (observable entity),20020131,1,900000000000207008,900000000000074008
38080001,"Reciprocal innervation, function (observable entity)",20020131,1,900000000000207008,900000000000074008
59328004,Forced expired volume in 1 second (observable entity),20020131,1,900000000000207008,900000000000074008
60747006,Doll's head reflex (observable entity),20020131,1,900000000000207008,900000000000074008
60984000,"Non-rapid eye movement sleep, function (observable entity)",20020131,1,900000000000207008,900000000000074008
61017008,Lung relaxation pressure (observable entity),20020131,1,900000000000207008,900000000000074008
60534004,"Muscle isometric contraction, function (observable entity)",20020131,1,900000000000207008,900000000000074008
57605004,Modified Dukes stage D (finding),20020131,1,900000000000207008,900000000000074008
57566009,Total lung capacity (observable entity),20020131,1,900000000000207008,900000000000074008
57206007,Singing (observable entity),20020131,1,900000000000207008,900000000000074008
57036006,Fetal gestational age (observable entity),20020131,1,900000000000207008,900000000000074008
57427004,Handedness (observable entity),20020131,1,900000000000207008,900000000000074008
57306005,Modified Dukes stage C2 (finding),20020131,1,900000000000207008,900000000000074008
58608000,Upper esophageal sphincter pressure (observable entity),20020131,1,900000000000207008,900000000000074008
58915005,Immune status (observable entity),20020131,1,900000000000207008,900000000000074008
58516001,"Antagonist muscle action, function (observable entity)",20020131,1,900000000000207008,900000000000074008
63498000,Diving (qualifier value),20020131,1,900000000000207008,900000000000074008
65077007,Disjunctive ocular movement (observable entity),20020131,1,900000000000207008,900000000000074008
64607003,Coordinated eye movement (observable entity),20020131,1,900000000000207008,900000000000074008
61931005,Postvaccination state (observable entity),20020131,1,900000000000207008,900000000000074008
61428000,"Muscle isotonic contraction, function (observable entity)",20020131,1,900000000000207008,900000000000074008
62262004,Minimum volume (observable entity),20020131,1,900000000000207008,900000000000074008
51478000,Maximal gastric acid secretory capacity (observable entity),20020131,1,900000000000207008,900000000000074008
51717002,Expired carbon dioxide concentration (observable entity),20020131,1,900000000000207008,900000000000074008
51104005,Pitch (observable entity),20020131,1,900000000000207008,900000000000074008
52653008,Respiratory sounds (observable entity),20020131,1,900000000000207008,900000000000074008
49169007,Head compression response (observable entity),20020131,1,900000000000207008,900000000000074008
50542000,Clark melanoma level 2 (finding),20020131,1,900000000000207008,900000000000074008
50834005,Forced vital capacity (observable entity),20020131,1,900000000000207008,900000000000074008
50373000,Body height measure (observable entity),20020131,1,900000000000207008,900000000000074008
49950003,Meal-stimulated gastric acid secretion (observable entity),20020131,1,900000000000207008,900000000000074008
55591008,Conjunctive eye movement (observable entity),20020131,1,900000000000207008,900000000000074008
55562005,Inspiratory reserve volume (observable entity),20020131,1,900000000000207008,900000000000074008
55532004,Expiratory reserve volume (observable entity),20020131,1,900000000000207008,900000000000074008
56769006,Modified Dukes stage A (finding),20020131,1,900000000000207008,900000000000074008
53173007,Modified Dukes stage B2 (finding),20020131,1,900000000000207008,900000000000074008
54498006,Modified Dukes stage C1 (finding),20020131,1,900000000000207008,900000000000074008
10947000,"Synergist muscle action, function (observable entity)",20020131,1,900000000000207008,900000000000074008
12140005,"Muscle contraction, function (observable entity)",20020131,1,900000000000207008,900000000000074008
11977004,"Muscle relaxation, function (observable entity)",20020131,1,900000000000207008,900000000000074008
8625004,Legal status (observable entity),20020131,1,900000000000207008,900000000000074008
8690003,Diaphragmatic excursion (observable entity),20020131,1,900000000000207008,900000000000074008
9576003,Esophageal pressure (observable entity),20020131,1,900000000000207008,900000000000074008
14951008,Fatherhood (observable entity),20020131,1,900000000000207008,900000000000074008
14468000,Sports activity (observable entity),20020131,1,900000000000207008,900000000000074008
15876000,McMurray test response (observable entity),20020131,1,900000000000207008,900000000000074008
16162007,Total airway resistance (observable entity),20020131,1,900000000000207008,900000000000074008
16034002,Clark melanoma level 5 (finding),20020131,1,900000000000207008,900000000000074008
14075006,Static-line parachuting (qualifier value),20020131,1,900000000000207008,900000000000074008
13621006,Tidal volume (observable entity),20020131,1,900000000000207008,900000000000074008
2548005,Peak gastric acid output (observable entity),20020131,1,900000000000207008,900000000000074008
2767007,Dysergia (observable entity),20020131,1,900000000000207008,900000000000074008
3863008,Lung compliance (observable entity),20020131,1,900000000000207008,900000000000074008
3030002,ST segment (observable entity),20020131,1,900000000000207008,900000000000074008
1556006,Clark melanoma level 4 (finding),20020131,1,900000000000207008,900000000000074008
6942003,Level of consciousness (observable entity),20020131,1,900000000000207008,900000000000074008
6918002,Muscle tone (observable entity),20020131,1,900000000000207008,900000000000074008
6427007,Chest expansion (observable entity),20020131,1,900000000000207008,900000000000074008
6304003,Airway resistance (observable entity),20020131,1,900000000000207008,900000000000074008
7542004,Personal status (observable entity),20020131,1,900000000000207008,900000000000074008
4683004,Living condition (observable entity),20020131,1,900000000000207008,900000000000074008
4751000,Leisure physical activity (observable entity),20020131,1,900000000000207008,900000000000074008
4065008,Affect function (observable entity),20020131,1,900000000000207008,900000000000074008
4051006,Finkelsteins test response (observable entity),20020131,1,900000000000207008,900000000000074008
5222008,Pressure difference between alveoli and mouth (observable entity),20020131,1,900000000000207008,900000000000074008
28239005,Two point static discrimination response (observable entity),20020131,1,900000000000207008,900000000000074008
27625002,Wakefulness (observable entity),20020131,1,900000000000207008,900000000000074008
27556003,Lachman test response (observable entity),20020131,1,900000000000207008,900000000000074008
27913002,Maximum inspiratory pressure (observable entity),20020131,1,900000000000207008,900000000000074008
24607002,Q wave feature (observable entity),20020131,1,900000000000207008,900000000000074008
31261004,"Agonist muscle action, function (observable entity)",20020131,1,900000000000207008,900000000000074008
31498000,Cephalic-vagal gastric acid secretion (observable entity),20020131,1,900000000000207008,900000000000074008
31346003,"Muscle property, function (observable entity)",20020131,1,900000000000207008,900000000000074008
32198009,Parachuting (qualifier value),20020131,1,900000000000207008,900000000000074008
31763002,Ocular motility observable (observable entity),20020131,1,900000000000207008,900000000000074008
31747005,Modified Dukes stage B1 (finding),20020131,1,900000000000207008,900000000000074008
28895007,Sky-diving (qualifier value),20020131,1,900000000000207008,900000000000074008
30367009,Lung clearance index (observable entity),20020131,1,900000000000207008,900000000000074008
29533001,Inspiratory capacity (observable entity),20020131,1,900000000000207008,900000000000074008
19166009,Stapedial reflex (observable entity),20020131,1,900000000000207008,900000000000074008
18491006,Peak expiratory flow rate (observable entity),20020131,1,900000000000207008,900000000000074008
19982009,Dead space gas volume (observable entity),20020131,1,900000000000207008,900000000000074008
17202005,Maximum expiratory pressure (observable entity),20020131,1,900000000000207008,900000000000074008
17456000,Breslow measurement - depth from 0.76 to 1.75 mm (finding),20020131,1,900000000000207008,900000000000074008
17328006,Flow of urine (observable entity),20020131,1,900000000000207008,900000000000074008
22751002,"Contraction of external anal sphincter, function (observable entity)",20020131,1,900000000000207008,900000000000074008
22690006,Nerve conduction (observable entity),20020131,1,900000000000207008,900000000000074008
23980007,Apley test response (observable entity),20020131,1,900000000000207008,900000000000074008
20910001,Pivot shift test response (observable entity),20020131,1,900000000000207008,900000000000074008
21122005,Femoral nerve stretch response (observable entity),20020131,1,900000000000207008,900000000000074008
21165006,Clark melanoma level 3 (finding),20020131,1,900000000000207008,900000000000074008
20426007,Volume history of lung (observable entity),20020131,1,900000000000207008,900000000000074008
20733006,Living place (observable entity),20020131,1,900000000000207008,900000000000074008
20635005,Semi-open circuit scuba diving (qualifier value),20020131,1,900000000000207008,900000000000074008
77219005,Saccadic eye movement (observable entity),20020131,1,900000000000207008,900000000000074008
91444001,Smooth pursuit movement (observable entity),20020131,1,900000000000207008,900000000000074008
78513008,Fusion binocular vision (observable entity),20020131,1,900000000000207008,900000000000074008
89919001,Transmural pressure (observable entity),20020131,1,900000000000207008,900000000000074008
79010009,Parenthood (observable entity),20020131,1,900000000000207008,900000000000074008
90062008,Gastric tonus (observable entity),20020131,1,900000000000207008,900000000000074008
78718001,Muscle function (observable entity),20020131,1,900000000000207008,900000000000074008
91343008,Lower esophageal sphincter pressure (observable entity),20020131,1,900000000000207008,900000000000074008
75098008,Flow history (observable entity),20020131,1,900000000000207008,900000000000074008
75335000,Scuba diving (qualifier value),20020131,1,900000000000207008,900000000000074008
83204003,Free diving (qualifier value),20020131,1,900000000000207008,900000000000074008
83284001,Clark melanoma level 1 (finding),20020131,1,900000000000207008,900000000000074008
82984001,Posterior drawer test response (observable entity),20020131,1,900000000000207008,900000000000074008
83411002,Slow vital capacity (observable entity),20020131,1,900000000000207008,900000000000074008
82187007,Gastric acid secretion (observable entity),20020131,1,900000000000207008,900000000000074008
87042004,Bowel sounds (observable entity),20020131,1,900000000000207008,900000000000074008
85662007,Intravesical pressure (observable entity),20020131,1,900000000000207008,900000000000074008
84917001,Indirect light pupillary reflex (observable entity),20020131,1,900000000000207008,900000000000074008
84747008,Apley distraction test response (observable entity),20020131,1,900000000000207008,900000000000074008
85275003,Compressed air hose diving (qualifier value),20020131,1,900000000000207008,900000000000074008
86189008,Cerebrospinal fluid pressure (observable entity),20020131,1,900000000000207008,900000000000074008
86069005,Breslow measurement - depth less than 0.76 mm (finding),20020131,1,900000000000207008,900000000000074008
89129007,"Rapid eye movement sleep, function (observable entity)",20020131,1,900000000000207008,900000000000074008
88676009,Gross diagnosis (observable entity),20020131,1,900000000000207008,900000000000074008
79412009,Specific airway conductance (observable entity),20020131,1,900000000000207008,900000000000074008
89624001,Partial expiratory flow-static recoil curve (observable entity),20020131,1,900000000000207008,900000000000074008
79063001,Gas flow rate (v) (observable entity),20020131,1,900000000000207008,900000000000074008
89315003,Anatomical dead space (observable entity),20020131,1,900000000000207008,900000000000074008
89365007,"Muscle latency relaxation, function (observable entity)",20020131,1,900000000000207008,900000000000074008
81435004,QT interval feature (observable entity),20020131,1,900000000000207008,900000000000074008
88343004,Expiratory residual volume (observable entity),20020131,1,900000000000207008,900000000000074008
88345006,Carbon dioxide response curve measurement (observable entity),20020131,1,900000000000207008,900000000000074008
80633008,Suppression (observable entity),20020131,1,900000000000207008,900000000000074008
81184002,R wave feature (observable entity),20020131,1,900000000000207008,900000000000074008
88265002,Physiological dead space (observable entity),20020131,1,900000000000207008,900000000000074008
105717002,Condition AND/OR status of human remains (observable entity),20020131,1,900000000000207008,900000000000074008
105575000,Religiousness (observable entity),20020131,1,900000000000207008,900000000000074008
105576004,Religious commitment (observable entity),20020131,1,900000000000207008,900000000000074008
70017002,"Muscle elasticity, function (observable entity)",20020131,1,900000000000207008,900000000000074008
71172009,Volume of expired gas (observable entity),20020131,1,900000000000207008,900000000000074008
66621004,Sexual orientation (observable entity),20020131,1,900000000000207008,900000000000074008
110343009,Tongue thrust (observable entity),20020131,1,900000000000207008,900000000000074008
105417001,Disappearance of partner (finding),20020131,1,900000000000207008,900000000000074008
105421008,Educational achievement (observable entity),20020131,1,900000000000207008,900000000000074008
105422001,Poor education (finding),20020131,1,900000000000207008,900000000000074008
105423006,Good education (finding),20020131,1,900000000000207008,900000000000074008
70464006,Laryngeal airflow resistance (observable entity),20020131,1,900000000000207008,900000000000074008
70778006,Gas transport time peak following bronchodilator (observable entity),20020131,1,900000000000207008,900000000000074008
68362006,Binocular vision observable (observable entity),20020131,1,900000000000207008,900000000000074008
68545002,Gastric secretion (observable entity),20020131,1,900000000000207008,900000000000074008
68592003,Body composition (observable entity),20020131,1,900000000000207008,900000000000074008
108331001,Parental state (observable entity),20020131,1,900000000000207008,900000000000074008
68130003,Physical activity (observable entity),20020131,1,900000000000207008,900000000000074008
67461000,Alveolar pressure (observable entity),20020131,1,900000000000207008,900000000000074008
65825000,Functional residual capacity (observable entity),20020131,1,900000000000207008,900000000000074008
74397004,Living quarters (observable entity),20020131,1,900000000000207008,900000000000074008
111965008,Glottal airflow resistance (observable entity),20020131,1,900000000000207008,900000000000074008
111964007,Regional vital capacity (observable entity),20020131,1,900000000000207008,900000000000074008
111969002,Diaphragmatic movement (observable entity),20020131,1,900000000000207008,900000000000074008
65751005,Mixed gas hose diving (qualifier value),20020131,1,900000000000207008,900000000000074008
74024006,Dental caries susceptibility (observable entity),20020131,1,900000000000207008,900000000000074008
65453009,"Chalasia, function (observable entity)",20020131,1,900000000000207008,900000000000074008
102474005,Unexpected therapeutic effect (observable entity),20020131,1,900000000000207008,900000000000074008
102545003,"Lengthening muscle contraction, function (observable entity)",20020131,1,900000000000207008,900000000000074008
102546002,"Paradoxical muscle contraction, function (observable entity)",20020131,1,900000000000207008,900000000000074008
102547006,"Muscle action potential, function (observable entity)",20020131,1,900000000000207008,900000000000074008
65401001,"Psychomotor development, function (observable entity)",20020131,1,900000000000207008,900000000000074008
102544004,"Shortening muscle contraction, function (observable entity)",20020131,1,900000000000207008,900000000000074008
102542000,"Involuntary muscle contraction, function (observable entity)",20020131,1,900000000000207008,900000000000074008
66332009,"Muscle innervation, function (observable entity)",20020131,1,900000000000207008,900000000000074008
72066008,Basal gastric acid secretion (observable entity),20020131,1,900000000000207008,900000000000074008
103579009,Race (observable entity),20020131,1,900000000000207008,900000000000074008
103420007,Modified Dukes stage (observable entity),20020131,1,900000000000207008,900000000000074008
72947005,Maximum expiratory flow-static recoil curve (observable entity),20020131,1,900000000000207008,900000000000074008
71750001,Airborne lead (Pb) concentration (observable entity),20020131,1,900000000000207008,900000000000074008
370980007,"Fine motor coordination, function (observable entity)",20020731,1,900000000000207008,900000000000074008
370993002,Auditory acuity (observable entity),20020731,1,900000000000207008,900000000000074008
370962003,Orbit observable (observable entity),20020731,1,900000000000207008,900000000000074008
370959001,Lens thickness (observable entity),20020731,1,900000000000207008,900000000000074008
370955007,Corneal sensation (observable entity),20020731,1,900000000000207008,900000000000074008
370954006,Corneal curvature refracting power (observable entity),20020731,1,900000000000207008,900000000000074008
370938008,Horizontal cup disc ratio (observable entity),20020731,1,900000000000207008,900000000000074008
370937003,Vertical cup disc ratio (observable entity),20020731,1,900000000000207008,900000000000074008
370973005,Academic progress (observable entity),20020731,1,900000000000207008,900000000000074008
373063009,Substance observable (observable entity),20020731,1,900000000000207008,900000000000074008
373064003,Drug observable (observable entity),20020731,1,900000000000207008,900000000000074008
373197004,"Polyp size, largest dimension (observable entity)",20020731,1,900000000000207008,900000000000074008
373860006,Afterloaded brachytherapy source (observable entity),20020731,1,900000000000207008,900000000000074008
373861005,Manually afterloaded brachytherapy source (observable entity),20020731,1,900000000000207008,900000000000074008
373862003,Remotely afterloaded brachytherapy source (observable entity),20020731,1,900000000000207008,900000000000074008
373859001,Brachytherapy source loading method (observable entity),20020731,1,900000000000207008,900000000000074008
373642008,Extraocular eye movement (observable entity),20020731,1,900000000000207008,900000000000074008
373719009,Continuity of fetal heart sounds (observable entity),20020731,1,900000000000207008,900000000000074008
373720003,Site of loudest fetal heart sounds (observable entity),20020731,1,900000000000207008,900000000000074008
373848005,External beam radiation therapy geometry parameters (observable entity),20020731,1,900000000000207008,900000000000074008
373849002,Fixed field external beam radiation therapy parameters (observable entity),20020731,1,900000000000207008,900000000000074008
373850002,Single field external beam radiation therapy (observable entity),20020731,1,900000000000207008,900000000000074008
373851003,Two field external beam radiation therapy (observable entity),20020731,1,900000000000207008,900000000000074008
373852005,Three field external beam radiation therapy (observable entity),20020731,1,900000000000207008,900000000000074008
373853000,Four field external beam radiation therapy (observable entity),20020731,1,900000000000207008,900000000000074008
371846000,Pulmonary valve flow (observable entity),20020731,1,900000000000207008,900000000000074008
371847009,Tricuspid diastolic filling period (observable entity),20020731,1,900000000000207008,900000000000074008
